{
  "last_updated": "2026-10-23 08:52:54 IST",
  "timestamp_utc": "2026-10-23T08:52:54.739958+00:00",
  "market_status": "Closed",
  "data_status": "Success",
  "total_symbols_scanned": 45,
  "valid_rows_count": 45,
  "qualified_count": 15,
  "watch_count": 1,
  "rejected_count": 29,
  "schema_version": "1.0.0",
  "rejected_rows": [],
  "errors": []
}